{
  "manifest": {
    "contract_name": "signguy-slim-portable",
    "contract_version": "1.0.0",
    "package_id": "sgp_v1_package_00000000-0000-4000-8000-000000000001",
    "created_at": "2026-08-20T00:00:00Z",
    "source_app": "SIGNGUY-SLIM",
    "source_app_version": "0.1.0-v1-part1",
    "schema_sha256": "0000000000000000000000000000000000000000000000000000000000000000",
    "content_sha256": "0000000000000000000000000000000000000000000000000000000000000000",
    "encryption": {
      "protected": false,
      "algorithm": "none"
    },
    "contains_secrets": false
  },
  "tenants": [
    {
      "portable_id": "sgp_v1_tenant_00000000-0000-4000-8000-000000000010",
      "name": "Golden Empty Tenant",
      "timezone": "America/New_York",
      "sales_tax_rate_basis_points": 0
    }
  ],
  "customers": [],
  "estimates": [],
  "orders": [],
  "order_items": [],
  "invoices": [],
  "calendar_events": [],
  "reminders": [],
  "notes": [],
  "attachments": []
}
